{
  "$schema": "https://json-schema.org/draft/2020-12/schema",
  "$id": "https://p4p.example/schemas/provider-manifest.schema.json",
  "title": "P4P Module Provider Manifest",
  "type": "object",
  "additionalProperties": false,
  "required": [
    "provider_id",
    "name",
    "description",
    "website",
    "public_key",
    "contact",
    "modules",
    "supported_lanes",
    "status",
    "signature"
  ],
  "properties": {
    "provider_id": {
      "type": "string",
      "pattern": "^[a-z0-9]+(?:\\.[a-z0-9-]+)+$"
    },
    "name": {
      "type": "string",
      "minLength": 1
    },
    "description": {
      "type": "string",
      "minLength": 1
    },
    "website": {
      "type": "string",
      "format": "uri"
    },
    "public_key": {
      "anyOf": [
        {
          "type": "string",
          "pattern": "^ed25519:"
        },
        {
          "type": "null"
        }
      ]
    },
    "contact": {
      "anyOf": [
        {
          "type": "string",
          "minLength": 1
        },
        {
          "type": "null"
        }
      ]
    },
    "modules": {
      "type": "array",
      "minItems": 1,
      "uniqueItems": true,
      "items": {
        "type": "string",
        "pattern": "^[a-z0-9]+(?:\\.[a-z0-9-]+)+$"
      }
    },
    "supported_lanes": {
      "type": "array",
      "minItems": 1,
      "uniqueItems": true,
      "items": {
        "type": "string",
        "enum": ["public_capability", "operator", "trust", "observability"]
      }
    },
    "status": {
      "type": "string",
      "minLength": 1
    },
    "signature": {
      "anyOf": [
        {
          "type": "string",
          "pattern": "^ed25519:"
        },
        {
          "type": "null"
        }
      ]
    }
  }
}
