{
  "provider_id": "p4p.reference",
  "name": "P4P Reference Modules",
  "description": "Reference provider manifest for the first P4P module examples and draft execution contract.",
  "website": "https://github.com/DennisHedegreen/p4p",
  "public_key": null,
  "contact": null,
  "modules": [
    "p4p.notify.email",
    "p4p.order.print",
    "p4p.payment.cash",
    "p4p.stock.basic",
    "p4p.trust.cvr-basic"
  ],
  "supported_lanes": ["public_capability", "operator", "trust"],
  "status": "unsigned-reference",
  "signature": null
}
